{
  "schema": "yapcad-viewer-scene-v1",
  "sessionId": "77777777-7777-4777-8777-777777777777",
  "revision": 0,
  "units": "millimetre",
  "assets": [
    {
      "id": "sha256:44655bf0d68183913092860dced5ea32a1f7f7daf3de3fb030667a3b2460a253",
      "componentId": "chassis-proxy",
      "mediaType": "model/gltf-binary",
      "byteLength": 1596,
      "sourceRepresentation": "brep",
      "derivationDigest": "sha256:5848081ef2df006cb649fbd0c508b196fa95e4783f8f80399c45a3f7204054b0",
      "generatorFingerprint": "yapCAD demo fixture; OpenCASCADE-derived",
      "tessellation": {
        "linearDeflectionMm": 0.25,
        "angularDeflectionRad": 0.5
      }
    },
    {
      "id": "sha256:34f540fa0d93efb6367bc468ee64bb282442807ad96fc2e46f3fd769d9af8411",
      "componentId": "rocker-proxy",
      "mediaType": "model/gltf-binary",
      "byteLength": 1588,
      "sourceRepresentation": "brep",
      "derivationDigest": "sha256:6d0370d3a62b674bbec280825774e6c30f769b78b3f89703ca4df6a355373b01",
      "generatorFingerprint": "yapCAD demo fixture; OpenCASCADE-derived",
      "tessellation": {
        "linearDeflectionMm": 0.25,
        "angularDeflectionRad": 0.5
      }
    },
    {
      "id": "sha256:8db6cc16075fe11a0008cc1c601ab2b428ecb0cbbf25d30346dca6c748d258d9",
      "componentId": "bogie-proxy",
      "mediaType": "model/gltf-binary",
      "byteLength": 1588,
      "sourceRepresentation": "brep",
      "derivationDigest": "sha256:fd2811bccf33f1c57c472e15007fae08eceb34d50e8dd512040181ac6440248d",
      "generatorFingerprint": "yapCAD demo fixture; OpenCASCADE-derived",
      "tessellation": {
        "linearDeflectionMm": 0.25,
        "angularDeflectionRad": 0.5
      }
    },
    {
      "id": "sha256:70673323c9f7861d068641a10cad7b5d3a1c8b1ccf93e3c14c45db04ee9f8096",
      "componentId": "wheel-proxy",
      "mediaType": "model/gltf-binary",
      "byteLength": 8284,
      "sourceRepresentation": "brep",
      "derivationDigest": "sha256:16a5c6a1e928284c2a529a8ad57c68473507484fb928e82cfac2ace268c6e7db",
      "generatorFingerprint": "yapCAD demo fixture; OpenCASCADE-derived",
      "tessellation": {
        "linearDeflectionMm": 0.25,
        "angularDeflectionRad": 0.5
      }
    }
  ],
  "nodes": [
    {
      "id": "chassis",
      "name": "Chassis",
      "componentId": "chassis-proxy",
      "parentId": null,
      "materialId": "petg",
      "assetId": "sha256:44655bf0d68183913092860dced5ea32a1f7f7daf3de3fb030667a3b2460a253",
      "transform": [
        1.0,
        0.0,
        0.0,
        0.0,
        0.0,
        1.0,
        0.0,
        0.0,
        0.0,
        0.0,
        1.0,
        0.0,
        0.0,
        0.0,
        0.0,
        1.0
      ],
      "visible": true
    },
    {
      "id": "left_rocker",
      "name": "Left rocker",
      "componentId": "rocker-proxy",
      "parentId": "chassis",
      "materialId": "petg",
      "assetId": "sha256:34f540fa0d93efb6367bc468ee64bb282442807ad96fc2e46f3fd769d9af8411",
      "transform": [
        0.9902680687415704,
        0.0,
        -0.13917310096006544,
        0.0,
        0.0,
        1.0,
        0.0,
        0.0,
        0.13917310096006544,
        0.0,
        0.9902680687415704,
        0.0,
        0.0,
        155.0,
        0.0,
        1.0
      ],
      "visible": true
    },
    {
      "id": "right_rocker",
      "name": "Right rocker",
      "componentId": "rocker-proxy",
      "parentId": "chassis",
      "materialId": "petg",
      "assetId": "sha256:34f540fa0d93efb6367bc468ee64bb282442807ad96fc2e46f3fd769d9af8411",
      "transform": [
        0.9902680687415704,
        0.0,
        0.13917310096006544,
        0.0,
        0.0,
        1.0,
        0.0,
        0.0,
        -0.13917310096006544,
        0.0,
        0.9902680687415704,
        0.0,
        0.0,
        -155.0,
        0.0,
        1.0
      ],
      "visible": true
    },
    {
      "id": "left_bogie",
      "name": "Left bogie",
      "componentId": "bogie-proxy",
      "parentId": "left_rocker",
      "materialId": "petg",
      "assetId": "sha256:8db6cc16075fe11a0008cc1c601ab2b428ecb0cbbf25d30346dca6c748d258d9",
      "transform": [
        0.9902680687415704,
        0.0,
        -0.13917310096006544,
        0.0,
        0.0,
        1.0,
        0.0,
        0.0,
        0.13917310096006544,
        0.0,
        0.9902680687415704,
        0.0,
        -98.94652506405149,
        155.0,
        -21.437937814748746,
        1.0
      ],
      "visible": true
    },
    {
      "id": "right_bogie",
      "name": "Right bogie",
      "componentId": "bogie-proxy",
      "parentId": "right_rocker",
      "materialId": "petg",
      "assetId": "sha256:8db6cc16075fe11a0008cc1c601ab2b428ecb0cbbf25d30346dca6c748d258d9",
      "transform": [
        0.9902680687415704,
        0.0,
        0.13917310096006544,
        0.0,
        0.0,
        1.0,
        0.0,
        0.0,
        -0.13917310096006544,
        0.0,
        0.9902680687415704,
        0.0,
        -89.2044079968469,
        -155.0,
        -47.88082699716118,
        1.0
      ],
      "visible": true
    },
    {
      "id": "left_front_wheel",
      "name": "Left front wheel",
      "componentId": "wheel-proxy",
      "parentId": "left_rocker",
      "materialId": "petg",
      "assetId": "sha256:70673323c9f7861d068641a10cad7b5d3a1c8b1ccf93e3c14c45db04ee9f8096",
      "transform": [
        0.9902680687415704,
        0.0,
        -0.13917310096006544,
        0.0,
        0.0,
        1.0,
        0.0,
        0.0,
        0.13917310096006544,
        0.0,
        0.9902680687415704,
        0.0,
        177.71295048889348,
        155.0,
        -100.71299433803021,
        1.0
      ],
      "visible": true
    },
    {
      "id": "left_middle_wheel",
      "name": "Left middle wheel",
      "componentId": "wheel-proxy",
      "parentId": "left_bogie",
      "materialId": "petg",
      "assetId": "sha256:70673323c9f7861d068641a10cad7b5d3a1c8b1ccf93e3c14c45db04ee9f8096",
      "transform": [
        0.9902680687415704,
        0.0,
        -0.13917310096006544,
        0.0,
        0.0,
        1.0,
        0.0,
        0.0,
        0.13917310096006544,
        0.0,
        0.9902680687415704,
        0.0,
        -10.437982572004913,
        155.0,
        -74.27010515561778,
        1.0
      ],
      "visible": true
    },
    {
      "id": "left_rear_wheel",
      "name": "Left rear wheel",
      "componentId": "wheel-proxy",
      "parentId": "left_bogie",
      "materialId": "petg",
      "assetId": "sha256:70673323c9f7861d068641a10cad7b5d3a1c8b1ccf93e3c14c45db04ee9f8096",
      "transform": [
        0.9902680687415704,
        0.0,
        -0.13917310096006544,
        0.0,
        0.0,
        1.0,
        0.0,
        0.0,
        0.13917310096006544,
        0.0,
        0.9902680687415704,
        0.0,
        -198.5889156329033,
        155.0,
        -47.82721597320534,
        1.0
      ],
      "visible": true
    },
    {
      "id": "right_front_wheel",
      "name": "Right front wheel",
      "componentId": "wheel-proxy",
      "parentId": "right_rocker",
      "materialId": "petg",
      "assetId": "sha256:70673323c9f7861d068641a10cad7b5d3a1c8b1ccf93e3c14c45db04ee9f8096",
      "transform": [
        0.9902680687415704,
        0.0,
        0.13917310096006544,
        0.0,
        0.0,
        1.0,
        0.0,
        0.0,
        -0.13917310096006544,
        0.0,
        0.9902680687415704,
        0.0,
        198.58891563290328,
        -155.0,
        -47.82721597320534,
        1.0
      ],
      "visible": true
    },
    {
      "id": "right_middle_wheel",
      "name": "Right middle wheel",
      "componentId": "wheel-proxy",
      "parentId": "right_bogie",
      "materialId": "petg",
      "assetId": "sha256:70673323c9f7861d068641a10cad7b5d3a1c8b1ccf93e3c14c45db04ee9f8096",
      "transform": [
        0.9902680687415704,
        0.0,
        0.13917310096006544,
        0.0,
        0.0,
        1.0,
        0.0,
        0.0,
        -0.13917310096006544,
        0.0,
        0.9902680687415704,
        0.0,
        10.437982572004913,
        -155.0,
        -74.27010515561778,
        1.0
      ],
      "visible": true
    },
    {
      "id": "right_rear_wheel",
      "name": "Right rear wheel",
      "componentId": "wheel-proxy",
      "parentId": "right_bogie",
      "materialId": "petg",
      "assetId": "sha256:70673323c9f7861d068641a10cad7b5d3a1c8b1ccf93e3c14c45db04ee9f8096",
      "transform": [
        0.9902680687415704,
        0.0,
        0.13917310096006544,
        0.0,
        0.0,
        1.0,
        0.0,
        0.0,
        -0.13917310096006544,
        0.0,
        0.9902680687415704,
        0.0,
        -177.71295048889345,
        -155.0,
        -100.71299433803021,
        1.0
      ],
      "visible": true
    }
  ],
  "diagnostics": [],
  "digest": "sha256:3c9c9c4e6a8b602ecde6e5d2c25f7ded54674e1d556e5ea19905b558e2d9c990"
}
